{
  "generated_at": "2026-02-22T13:00:00.000Z",
  "total": 2,
  "healthy": 1,
  "degraded": 1,
  "items": [
    {
      "connector_id": "con_mcp_gateway",
      "status": "healthy",
      "manifest_loaded": true,
      "attestation_key_id": "att_dev_main_v1",
      "attestation_valid": true,
      "protocol": "mcp",
      "trust_level": "high_control",
      "category": "agent_protocol",
      "binding_count": 0,
      "active_binding_count": 0,
      "drift_count": 0
    },
    {
      "connector_id": "con_external_unknown",
      "status": "degraded",
      "manifest_loaded": false,
      "attestation_key_id": "unknown",
      "attestation_valid": false,
      "protocol": "unknown",
      "trust_level": "unknown",
      "category": "unknown",
      "binding_count": 1,
      "active_binding_count": 1,
      "drift_count": 1
    }
  ]
}
